{
  "candidate_ref": "art_01JBC7S1A2B3C4D5E6F7G8H9JK",
  "criteria": [
    {
      "id": "rc1",
      "text": "汇总结果与清洗后明细核对一致"
    },
    {
      "id": "rc2",
      "text": "满足需求中的全部约束"
    }
  ],
  "requirements_excerpt": [
    "把 /input/sales_2026q3.csv 清洗一下（去掉重复行、统一日期格式为 YYYY-MM-DD），然后按月汇总销售额，输出 summary.csv 和一份简短的说明。不要修改原始文件。金额保留两位小数。",
    "汇总改成按月和地区两个维度，另外加一张按地区的柱状图 PNG。"
  ],
  "request_id": "req_01JBC7Q5W8M2N3P4R5S6T7V8X9",
  "task_id": "tsk_01JBC7Q5W8M2N3P4R5S6T7V8X9",
  "requirements_revision": 2,
  "plan_revision": 2,
  "task_revision": 2,
  "instruction_revision": 2,
  "dispatcher_epoch": 1,
  "review_id": "review_01JBC7Q5W8M2N3P4R5S6T7V8X9",
  "submission_id": "sub_01JBC7Q5W8M2N3P4R5S6T7V8X9",
  "candidate_sha256": "bbbbbbbbbbbbbbbbbbbbbbbbbbbbbbbbbbbbbbbbbbbbbbbbbbbbbbbbbbbbbbbb",
  "round": 1,
  "reviewer_instruction_revision": 1,
  "reviewer_request_id": "req_01JBC7S1A2B3C4D5E6F7G8H9JK",
  "reviewer_task_id": "tsk_01JBC7S1A2B3C4D5E6F7G8H9JK",
  "reviewer_team_id": "team_01JBC7S1A2B3C4D5E6F7G8H9JK",
  "reviewer_requirements_revision": 1,
  "reviewer_plan_revision": 1,
  "reviewer_task_revision": 1,
  "reviewer_dispatcher_epoch": 1,
  "reviewer_execution_epoch": 1,
  "reviewer_policy_epoch": 1
}
